title,summary,published,year,month,category,url
"Intelligent behavior depends on the ecological niche: Scaling up AI to
  human-like intelligence in socio-cultural environments","This paper outlines a perspective on the future of AI, discussing directions
for machines models of human-like intelligence. We explain how developmental
and evolutionary theories of human cognition should further inform artificial
intelligence. We emphasize the role of ecological niches in sculpting
intelligent behavior, and in particular that human intelligence was
fundamentally shaped to adapt to a constantly changing socio-cultural
environment. We argue that a major limit of current work in AI is that it is
missing this perspective, both theoretically and experimentally. Finally, we
discuss the promising approach of developmental artificial intelligence,
modeling infant development through multi-scale interaction between
intrinsically motivated learning, embodiment and a fastly changing
socio-cultural environment. This paper takes the form of an interview of
Pierre-Yves Oudeyer by Mandred Eppe, organized within the context of a KI -
K{\""{u}}nstliche Intelligenz special issue in developmental robotics.",2021-03-11,2021,2021-03,environment,http://arxiv.org/abs/2103.06769v1
Modular Procedural Generation for Voxel Maps,"Task environments developed in Minecraft are becoming increasingly popular
for artificial intelligence (AI) research. However, most of these are currently
constructed manually, thus failing to take advantage of procedural content
generation (PCG), a capability unique to virtual task environments. In this
paper, we present mcg, an open-source library to facilitate implementing PCG
algorithms for voxel-based environments such as Minecraft. The library is
designed with human-machine teaming research in mind, and thus takes a
'top-down' approach to generation, simultaneously generating low and high level
machine-readable representations that are suitable for empirical research.
These can be consumed by downstream AI applications that consider human spatial
cognition. The benefits of this approach include rapid, scalable, and efficient
development of virtual environments, the ability to control the statistics of
the environment at a semantic level, and the ability to generate novel
environments in response to player actions in real time.",2021-04-18,2021,2021-04,environment,http://arxiv.org/abs/2104.08890v1
"An Efficient Application of Neuroevolution for Competitive Multiagent
  Learning","Multiagent systems provide an ideal environment for the evaluation and
analysis of real-world problems using reinforcement learning algorithms. Most
traditional approaches to multiagent learning are affected by long training
periods as well as high computational complexity. NEAT (NeuroEvolution of
Augmenting Topologies) is a popular evolutionary strategy used to obtain the
best performing neural network architecture often used to tackle optimization
problems in the field of artificial intelligence. This paper utilizes the NEAT
algorithm to achieve competitive multiagent learning on a modified pong game
environment in an efficient manner. The competing agents abide by different
rules while having similar observation space parameters. The proposed algorithm
utilizes this property of the environment to define a singular
neuroevolutionary procedure that obtains the optimal policy for all the agents.
The compiled results indicate that the proposed implementation achieves ideal
behaviour in a very short training period when compared to existing multiagent
reinforcement learning models.",2021-05-23,2021,2021-05,environment,http://arxiv.org/abs/2105.10907v1
"Multi-Context Systems: Dynamics and Evolution (Pre-Print of
  ""Multi-context systems in dynamic environments"")","Multi-Context Systems (MCS) model in Computational Logic distributed systems
composed of heterogeneous sources, or ""contexts"", interacting via special rules
called ""bridge rules"". In this paper, we consider how to enhance flexibility
and generality in bridge-rules definition and application. In particular, we
introduce and discuss some formal extensions of MCSs useful for a practical use
in dynamic environments, and we try to provide guidelines for implementations",2021-06-12,2021,2021-06,environment,http://arxiv.org/abs/2106.06780v1
"A Systematic Survey of Text Worlds as Embodied Natural Language
  Environments","Text Worlds are virtual environments for embodied agents that, unlike 2D or
3D environments, are rendered exclusively using textual descriptions. These
environments offer an alternative to higher-fidelity 3D environments due to
their low barrier to entry, providing the ability to study semantics,
compositional inference, and other high-level tasks with rich high-level action
spaces while controlling for perceptual input. This systematic survey outlines
recent developments in tooling, environments, and agent modeling for Text
Worlds, while examining recent trends in knowledge graphs, common sense
reasoning, transfer learning of Text World performance to higher-fidelity
environments, as well as near-term development targets that, once achieved,
make Text Worlds an attractive general research paradigm for natural language
processing.",2021-07-08,2021,2021-07,environment,http://arxiv.org/abs/2107.04132v1
"Artificial intelligence for Sustainable Energy: A Contextual Topic
  Modeling and Content Analysis","Parallel to the rising debates over sustainable energy and artificial
intelligence solutions, the world is currently discussing the ethics of
artificial intelligence and its possible negative effects on society and the
environment. In these arguments, sustainable AI is proposed, which aims at
advancing the pathway toward sustainability, such as sustainable energy. In
this paper, we offered a novel contextual topic modeling combining LDA, BERT,
and Clustering. We then combined these computational analyses with content
analysis of related scientific publications to identify the main scholarly
topics, sub-themes, and cross-topic themes within scientific research on
sustainable AI in energy. Our research identified eight dominant topics
including sustainable buildings, AI-based DSSs for urban water management,
climate artificial intelligence, Agriculture 4, the convergence of AI with IoT,
AI-based evaluation of renewable technologies, smart campus and engineering
education, and AI-based optimization. We then recommended 14 potential future
research strands based on the observed theoretical gaps. Theoretically, this
analysis contributes to the existing literature on sustainable AI and
sustainable energy, and practically, it intends to act as a general guide for
energy engineers and scientists, AI scientists, and social scientists to widen
their knowledge of sustainability in AI and energy convergence research.",2021-10-02,2021,2021-10,environment,http://arxiv.org/abs/2110.00828v1
"Perceptions and attitudes of Children and Young People to Artificial
  Intelligence in Medicine","There is increasing interest in Artificial Intelligence and its application
to medicine. Perceptions are less well-known, notably amongst children and
young people. 21 members of a Young Persons Advisory Group for research,
recommend creating an enabling environment with children and young people,
through educational workshops with practical examples that use Artificial
Intelligence to help, but not replace humans, address issues, build trust, and
effectively communicate about potential opportunities.",2021-10-10,2021,2021-10,environment,http://arxiv.org/abs/2110.04890v1
"Artificial Intelligence Technology analysis using Artificial
  Intelligence patent through Deep Learning model and vector space model","Thanks to rapid development of artificial intelligence technology in recent
years, the current artificial intelligence technology is contributing to many
part of society. Education, environment, medical care, military, tourism,
economy, politics, etc. are having a very large impact on society as a whole.
For example, in the field of education, there is an artificial intelligence
tutoring system that automatically assigns tutors based on student's level. In
the field of economics, there are quantitative investment methods that
automatically analyze large amounts of data to find investment laws to create
investment models or predict changes in financial markets. As such, artificial
intelligence technology is being used in various fields. So, it is very
important to know exactly what factors have an important influence on each
field of artificial intelligence technology and how the relationship between
each field is connected. Therefore, it is necessary to analyze artificial
intelligence technology in each field. In this paper, we analyze patent
documents related to artificial intelligence technology. We propose a method
for keyword analysis within factors using artificial intelligence patent data
sets for artificial intelligence technology analysis. This is a model that
relies on feature engineering based on deep learning model named KeyBERT, and
using vector space model. A case study of collecting and analyzing artificial
intelligence patent data was conducted to show how the proposed model can be
applied to real world problems.",2021-11-08,2021,2021-11,environment,http://arxiv.org/abs/2111.11295v1
"A Survey on Applications of Digital Human Avatars toward Virtual
  Co-presence","This paper investigates different approaches to build and use digital human
avatars toward interactive Virtual Co-presence (VCP) environments. We evaluate
the evolution of technologies for creating VCP environments and how the
advancement in Artificial Intelligence (AI) and Computer Graphics affect the
quality of VCP environments. We categorize different methods in the literature
based on their applications and methodology and compare various groups and
strategies based on their applications, contributions, and limitations. We also
have a brief discussion about the approaches that other forms of human
representation, rather than digital human avatars, have been utilized in VCP
environments. Our goal is to fill the gap in the research domain where there is
a lack of literature review investigating different approaches for creating
avatar-based VCP environments. We hope this study will be useful for future
research involving human representation in VCP or Virtual Reality (VR)
environments. To the best of our knowledge, it is the first survey research
that investigates avatar-based VCP environments. Specifically, the
categorization methodology suggested in this paper for avatar-based methods is
new.",2022-01-11,2022,2022-01,environment,http://arxiv.org/abs/2201.04168v1
"Creative Problem Solving in Artificially Intelligent Agents: A Survey
  and Framework","Creative Problem Solving (CPS) is a sub-area within Artificial Intelligence
(AI) that focuses on methods for solving off-nominal, or anomalous problems in
autonomous systems. Despite many advancements in planning and learning,
resolving novel problems or adapting existing knowledge to a new context,
especially in cases where the environment may change in unpredictable ways post
deployment, remains a limiting factor in the safe and useful integration of
intelligent systems. The emergence of increasingly autonomous systems dictates
the necessity for AI agents to deal with environmental uncertainty through
creativity. To stimulate further research in CPS, we present a definition and a
framework of CPS, which we adopt to categorize existing AI methods in this
field. Our framework consists of four main components of a CPS problem, namely,
1) problem formulation, 2) knowledge representation, 3) method of knowledge
manipulation, and 4) method of evaluation. We conclude our survey with open
research questions, and suggested directions for the future.",2022-04-21,2022,2022-04,environment,http://arxiv.org/abs/2204.10358v1
Unified Distributed Environment,"We propose Unified Distributed Environment (UDE), an environment
virtualization toolkit for reinforcement learning research. UDE is designed to
integrate environments built on any simulation platform such as Gazebo, Unity,
Unreal, and OpenAI Gym. Through environment virtualization, UDE enables
offloading the environment for execution on a remote machine while still
maintaining a unified interface. The UDE interface is designed to support
multi-agent by default. With environment virtualization and its interface
design, the agent policies can be trained in multiple machines for a
multi-agent environment. Furthermore, UDE supports integration with existing
major RL toolkits for researchers to leverage the benefits. This paper
discusses the components of UDE and its design decisions.",2022-05-14,2022,2022-05,environment,http://arxiv.org/abs/2205.06946v1
Autonomous Visual Navigation A Biologically Inspired Approach,"Inspired by the navigational behavior observed in the animal kingdom and
especially the navigational behavior of the ants, we attempt to simulate it in
an artificial environment by implementing different kinds of biomimetic
algorithms.",2022-09-19,2022,2022-09,environment,http://arxiv.org/abs/2209.09663v1
Explainability in autonomous pedagogically structured scenarios,"We present the notion of explainability for decision-making processes in a
pedagogically structured autonomous environment. Multi-agent systems that are
structured pedagogically consist of pedagogical teachers and learners that
operate in environments in which both are sometimes not fully aware of all the
states in the environment and beliefs of other agents thus making it
challenging to explain their decisions and actions with one another. This work
emphasises the need for robust and iterative explanation-based communication
between the pedagogical teacher and the learner. Explaining the rationale
behind multi-agent decisions in an interactive, partially observable
environment is necessary to build trustworthy and reliable communication
between pedagogical teachers and learners. Ongoing research is primarily
focused on explanations of the agents' behaviour towards humans, and there is a
lack of research on inter-agent explainability.",2022-10-21,2022,2022-10,environment,http://arxiv.org/abs/2210.12140v1
Transformers as Policies for Variable Action Environments,"In this project we demonstrate the effectiveness of the transformer encoder
as a viable architecture for policies in variable action environments. Using
it, we train an agent using Proximal Policy Optimisation (PPO) on multiple maps
against scripted opponents in the Gym-$\mu$RTS environment. The final agent is
able to achieve a higher return using half the computational resources of the
next-best RL agent, which used the GridNet architecture.
  The source code and pre-trained models are available here:
https://github.com/NiklasZ/transformers-for-variable-action-envs",2023-01-09,2023,2023-01,environment,http://arxiv.org/abs/2301.03679v1
"Self-mediated exploration in artificial intelligence inspired by
  cognitive psychology","Exploration of the physical environment is an indispensable precursor to data
acquisition and enables knowledge generation via analytical or direct trialing.
Artificial Intelligence lacks the exploratory capabilities of even the most
underdeveloped organisms, hindering its autonomy and adaptability. Supported by
cognitive psychology, this works links human behavior and artificial agents to
endorse self-development. In accordance with reported data, paradigms of
epistemic and achievement emotion are embedded to machine-learning methodology
contingent on their impact when decision making. A study is subsequently
designed to mirror previous human trials, which artificial agents are made to
undergo repeatedly towards convergence. Results demonstrate causality, learned
by the vast majority of agents, between their internal states and exploration
to match those reported for human counterparts. The ramifications of these
findings are pondered for both research into human cognition and betterment of
artificial intelligence.",2023-02-13,2023,2023-02,environment,http://arxiv.org/abs/2302.06615v1
Towards Measuring Ethicality of an Intelligent Assistive System,"Artificial intelligence (AI) based assistive systems, so called intelligent
assistive technology (IAT) are becoming increasingly ubiquitous by each day.
IAT helps people in improving their quality of life by providing intelligent
assistance based on the provided data. A few examples of such IATs include
self-driving cars, robot assistants and smart-health management solutions.
However, the presence of such autonomous entities poses ethical challenges
concerning the stakeholders involved in using these systems. There is a lack of
research when it comes to analysing how such IAT adheres to provided ethical
regulations due to ethical, logistic and cost issues associated with such an
analysis. In the light of the above-mentioned problem statement and issues, we
present a method to measure the ethicality of an assistive system. To perform
this task, we utilised our simulation tool that focuses on modelling navigation
and assistance of Persons with Dementia (PwD) in indoor environments. By
utilising this tool, we analyse how well different assistive strategies adhere
to provided ethical regulations such as autonomy, justice and beneficence of
the stakeholders.",2023-02-28,2023,2023-02,environment,http://arxiv.org/abs/2303.03929v1
Games for Artificial Intelligence Research: A Review and Perspectives,"Games have been the perfect test-beds for artificial intelligence research
for the characteristics that widely exist in real-world scenarios. Learning and
optimisation, decision making in dynamic and uncertain environments, game
theory, planning and scheduling, design and education are common research areas
shared between games and real-world problems. Numerous open-source games or
game-based environments have been implemented for studying artificial
intelligence. In addition to single- or multi-player, collaborative or
adversarial games, there has also been growing interest in implementing
platforms for creative design in recent years. Those platforms provide ideal
benchmarks for exploring and comparing artificial intelligence ideas and
techniques. This paper reviews the games and game-based platforms for
artificial intelligence research, provides guidance on matching particular
types of artificial intelligence with suitable games for testing and matching
particular needs in games with suitable artificial intelligence techniques,
discusses the research trend induced by the evolution of those games and
platforms, and gives an outlook.",2023-04-26,2023,2023-04,environment,http://arxiv.org/abs/2304.13269v4
Ambient Technology & Intelligence,"Ambient intelligence refers to technological enhanced electronic environments
which are both responsive and sensitive to the presence of people within their
environment. Environments that are integrated with ambient intelligence tends
to adapt to the needs of individuals within the environment in an unobtrusive
manner in such a way as to enhance everyday life thereby making interaction
with technology extremely seamless and well integrated. This capability was
made possible because it is a concept that combines several key technologies
such as IoT (Internet of Things) technology, sensor technology, AI (Artificial
Intelligence), and advanced human-computer interaction all embedded and
integrated together with the environment.",2023-05-18,2023,2023-05,environment,http://arxiv.org/abs/2305.10726v2
Robots in the Garden: Artificial Intelligence and Adaptive Landscapes,"This paper introduces ELUA, the Ecological Laboratory for Urban Agriculture,
a collaboration among landscape architects, architects and computer scientists
who specialize in artificial intelligence, robotics and computer vision. ELUA
has two gantry robots, one indoors and the other outside on the rooftop of a
6-story campus building. Each robot can seed, water, weed, and prune in its
garden. To support responsive landscape research, ELUA also includes sensor
arrays, an AI-powered camera, and an extensive network infrastructure. This
project demonstrates a way to integrate artificial intelligence into an
evolving urban ecosystem, and encourages landscape architects to develop an
adaptive design framework where design becomes a long-term engagement with the
environment.",2023-05-22,2023,2023-05,environment,http://arxiv.org/abs/2305.13019v1
"Enhancing Evacuation Planning through Multi-Agent Simulation and
  Artificial Intelligence: Understanding Human Behavior in Hazardous
  Environments","This paper focuses on the crucial task of addressing the evacuation of
hazardous places, which holds great importance for coordinators, event hosts,
and authorities. To facilitate the development of effective solutions, the
paper employs Artificial Intelligence (AI) techniques, specifically Multi-Agent
Systems (MAS), to construct a simulation model for evacuation. NetLogo is
selected as the simulation tool of choice due to its ability to provide a
comprehensive understanding of human behaviour in distressing situations within
hazardous environments. The primary objective of this paper is to enhance our
comprehension of how individuals react and respond during such distressing
situations. By leveraging AI and MAS, the simulation model aims to capture the
complex dynamics of evacuation scenarios, enabling policymakers and emergency
planners to make informed decisions and implement more efficient and effective
evacuation strategies. This paper endeavours to contribute to the advancement
of evacuation planning and ultimately improve the safety and well-being of
individuals in hazardous places",2023-06-11,2023,2023-06,environment,http://arxiv.org/abs/2307.09485v1
"Adaptive User-centered Neuro-symbolic Learning for Multimodal
  Interaction with Autonomous Systems","Recent advances in machine learning, particularly deep learning, have enabled
autonomous systems to perceive and comprehend objects and their environments in
a perceptual subsymbolic manner. These systems can now perform object
detection, sensor data fusion, and language understanding tasks. However, there
is a growing need to enhance these systems to understand objects and their
environments more conceptually and symbolically. It is essential to consider
both the explicit teaching provided by humans (e.g., describing a situation or
explaining how to act) and the implicit teaching obtained by observing human
behavior (e.g., through the system's sensors) to achieve this level of powerful
artificial intelligence. Thus, the system must be designed with multimodal
input and output capabilities to support implicit and explicit interaction
models. In this position paper, we argue for considering both types of inputs,
as well as human-in-the-loop and incremental learning techniques, for advancing
the field of artificial intelligence and enabling autonomous systems to learn
like humans. We propose several hypotheses and design guidelines and highlight
a use case from related work to achieve this goal.",2023-09-11,2023,2023-09,environment,http://arxiv.org/abs/2309.05787v1
"Life-inspired Interoceptive Artificial Intelligence for Autonomous and
  Adaptive Agents","Building autonomous -- i.e., choosing goals based on one's needs -- and
adaptive -- i.e., surviving in ever-changing environments -- agents has been a
holy grail of artificial intelligence (AI). A living organism is a prime
example of such an agent, offering important lessons about adaptive autonomy.
Here, we focus on interoception, a process of monitoring one's internal
environment to keep it within certain bounds, which underwrites the survival of
an organism. To develop AI with interoception, we need to factorize the state
variables representing internal environments from external environments and
adopt life-inspired mathematical properties of internal environment states.
This paper offers a new perspective on how interoception can help build
autonomous and adaptive agents by integrating the legacy of cybernetics with
recent advances in theories of life, reinforcement learning, and neuroscience.",2023-09-12,2023,2023-09,environment,http://arxiv.org/abs/2309.05999v2
"The Animal-AI Environment: A Virtual Laboratory For Comparative
  Cognition and Artificial Intelligence Research","The Animal-AI Environment is a unique game-based research platform designed
to facilitate collaboration between the artificial intelligence and comparative
cognition research communities. In this paper, we present the latest version of
the Animal-AI Environment, outlining several major features that make the game
more engaging for humans and more complex for AI systems. These features
include interactive buttons, reward dispensers, and player notifications, as
well as an overhaul of the environment's graphics and processing for
significant improvements in agent training time and quality of the human player
experience. We provide detailed guidance on how to build computational and
behavioural experiments with the Animal-AI Environment. We present results from
a series of agents, including the state-of-the-art deep reinforcement learning
agent Dreamer-v3, on newly designed tests and the Animal-AI Testbed of 900
tasks inspired by research in the field of comparative cognition. The Animal-AI
Environment offers a new approach for modelling cognition in humans and
non-human animals, and for building biologically inspired artificial
intelligence.",2023-12-18,2023,2023-12,environment,http://arxiv.org/abs/2312.11414v3
