title,summary,published,year,month,category,url
An architecture for the evaluation of intelligent systems,"One of the main research areas in Artificial Intelligence is the coding of
agents (programs) which are able to learn by themselves in any situation. This
means that agents must be useful for purposes other than those they were
created for, as, for example, playing chess. In this way we try to get closer
to the pristine goal of Artificial Intelligence. One of the problems to decide
whether an agent is really intelligent or not is the measurement of its
intelligence, since there is currently no way to measure it in a reliable way.
The purpose of this project is to create an interpreter that allows for the
execution of several environments, including those which are generated
randomly, so that an agent (a person or a program) can interact with them. Once
the interaction between the agent and the environment is over, the interpreter
will measure the intelligence of the agent according to the actions, states and
rewards the agent has undergone inside the environment during the test. As a
result we will be able to measure agents' intelligence in any possible
environment, and to make comparisons between several agents, in order to
determine which of them is the most intelligent. In order to perform the tests,
the interpreter must be able to randomly generate environments that are really
useful to measure agents' intelligence, since not any randomly generated
environment will serve that purpose.",2011-02-03,2011,2011-02,environment,http://arxiv.org/abs/1102.0714v1
"Planning to Be Surprised: Optimal Bayesian Exploration in Dynamic
  Environments","To maximize its success, an AGI typically needs to explore its initially
unknown world. Is there an optimal way of doing so? Here we derive an
affirmative answer for a broad class of environments.",2011-03-29,2011,2011-03,environment,http://arxiv.org/abs/1103.5708v1
Optimistic Agents are Asymptotically Optimal,"We use optimism to introduce generic asymptotically optimal reinforcement
learning agents. They achieve, with an arbitrary finite or compact class of
environments, asymptotically optimal behavior. Furthermore, in the finite
deterministic case we provide finite error bounds.",2012-09-29,2012,2012-09,environment,http://arxiv.org/abs/1210.0077v1
Ambiente de Planejamento Ipê,"In this work we investigate the systems that implements algorithms for the
planning problem in Artificial Intelligence, called planners, with especial
attention to the planners based on the plan graph. We analyze the problem of
comparing the performance of the different algorithms and we propose an
environment for the development and analysis of planners.",2012-10-23,2012,2012-10,environment,http://arxiv.org/abs/1210.6275v2
"Artificial Intelligence Framework for Simulating Clinical
  Decision-Making: A Markov Decision Process Approach","In the modern healthcare system, rapidly expanding costs/complexity, the
growing myriad of treatment options, and exploding information streams that
often do not effectively reach the front lines hinder the ability to choose
optimal treatment decisions over time. The goal in this paper is to develop a
general purpose (non-disease-specific) computational/artificial intelligence
(AI) framework to address these challenges. This serves two potential
functions: 1) a simulation environment for exploring various healthcare
policies, payment methodologies, etc., and 2) the basis for clinical artificial
intelligence - an AI that can think like a doctor. This approach combines
Markov decision processes and dynamic decision networks to learn from clinical
data and develop complex plans via simulation of alternative sequential
decision paths while capturing the sometimes conflicting, sometimes synergistic
interactions of various components in the healthcare system. It can operate in
partially observable environments (in the case of missing observations or data)
by maintaining belief states about patient health status and functions as an
online agent that plans and re-plans. This framework was evaluated using real
patient data from an electronic health record. Such an AI framework easily
outperforms the current treatment-as-usual (TAU) case-rate/fee-for-service
models of healthcare (Cost per Unit Change: $189 vs. $497) while obtaining a
30-35% increase in patient outcomes. Tweaking certain model parameters further
enhances this advantage, obtaining roughly 50% more improvement for roughly
half the costs. Given careful design and problem formulation, an AI simulation
framework can approximate optimal decisions even in complex and uncertain
environments. Future work is described that outlines potential lines of
research and integration of machine learning algorithms for personalized
medicine.",2013-01-10,2013,2013-01,environment,http://arxiv.org/abs/1301.2158v1
On Stable Multi-Agent Behavior in Face of Uncertainty,"A stable joint plan should guarantee the achievement of a designer's goal in
a multi-agent environment, while ensuring that deviations from the prescribed
plan would be detected. We present a computational framework where stable joint
plans can be studied, as well as several basic results about the
representation, verification and synthesis of stable joint plans.",2013-02-06,2013,2013-02,environment,http://arxiv.org/abs/1302.1570v1
"Incremental Map Generation by Low Cost Robots Based on
  Possibility/Necessity Grids","In this paper we present some results obtained with a troupe of low-cost
robots designed to cooperatively explore and adquire the map of unknown
structured orthogonal environments. In order to improve the covering of the
explored zone, the robots show different behaviours and cooperate by
transferring each other the perceived environment when they meet. The returning
robots deliver to a host computer their partial maps and the host incrementally
generates the map of the environment by means of apossibility/ necessity grid.",2013-02-06,2013,2013-02,environment,http://arxiv.org/abs/1302.1559v1
Ergo: A Graphical Environment for Constructing Bayesian,"We describe an environment that considerably simplifies the process of
generating Bayesian belief networks. The system has been implemented on readily
available, inexpensive hardware, and provides clarity and high performance. We
present an introduction to Bayesian belief networks, discuss algorithms for
inference with these networks, and delineate the classes of problems that can
be solved with this paradigm. We then describe the hardware and software that
constitute the system, and illustrate Ergo's use with several example",2013-03-27,2013,2013-03,environment,http://arxiv.org/abs/1304.1095v1
A Probabilistic Reasoning Environment,"A framework is presented for a computational theory of probabilistic
argument. The Probabilistic Reasoning Environment encodes knowledge at three
levels. At the deepest level are a set of schemata encoding the system's domain
knowledge. This knowledge is used to build a set of second-level arguments,
which are structured for efficient recapture of the knowledge used to construct
them. Finally, at the top level is a Bayesian network constructed from the
arguments. The system is designed to facilitate not just propagation of beliefs
and assimilation of evidence, but also the dynamic process of constructing a
belief network, evaluating its adequacy, and revising it when necessary.",2013-03-27,2013,2013-03,environment,http://arxiv.org/abs/1304.1130v1
"Enaction-Based Artificial Intelligence: Toward Coevolution with Humans
  in the Loop","This article deals with the links between the enaction paradigm and
artificial intelligence. Enaction is considered a metaphor for artificial
intelligence, as a number of the notions which it deals with are deemed
incompatible with the phenomenal field of the virtual. After explaining this
stance, we shall review previous works regarding this issue in terms of
artifical life and robotics. We shall focus on the lack of recognition of
co-evolution at the heart of these approaches. We propose to explicitly
integrate the evolution of the environment into our approach in order to refine
the ontogenesis of the artificial system, and to compare it with the enaction
paradigm. The growing complexity of the ontogenetic mechanisms to be activated
can therefore be compensated by an interactive guidance system emanating from
the environment. This proposition does not however resolve that of the
relevance of the meaning created by the machine (sense-making). Such
reflections lead us to integrate human interaction into this environment in
order to construct relevant meaning in terms of participative artificial
intelligence. This raises a number of questions with regards to setting up an
enactive interaction. The article concludes by exploring a number of issues,
thereby enabling us to associate current approaches with the principles of
morphogenesis, guidance, the phenomenology of interactions and the use of
minimal enactive interfaces in setting up experiments which will deal with the
problem of artificial intelligence in a variety of enaction-based ways.",2014-02-26,2014,2014-02,environment,http://arxiv.org/abs/1402.6663v1
"Cortex simulation system proposal using distributed computer network
  environments","In the dawn of computer science and the eve of neuroscience we participate in
rebirth of neuroscience due to new technology that allows us to deeply and
precisely explore whole new world that dwells in our brains.",2014-03-22,2014,2014-03,environment,http://arxiv.org/abs/1403.5701v1
Dynamic Sweep Filtering Algorithm for FlexC,"We investigate cumulative scheduling in uncertain environments, using
constraint programming. We detail in this paper the dynamic sweep filtering
algorithm of the FlexC global constraint.",2014-08-22,2014,2014-08,environment,http://arxiv.org/abs/1408.5377v1
"Hybrid Systems Knowledge Representation Using Modelling Environment
  System Techniques Artificial Intelligence","Knowledge-based or Artificial Intelligence techniques are used increasingly
as alternatives to more classical techniques to model ENVIRONMENTAL SYSTEMS.
Use of Artificial Intelligence (AI) in environmental modelling has increased
with recognition of its potential. In this paper we examine the DIFFERENT
TECHNIQUES of Artificial intelligence with profound examples of human
perception, learning and reasoning to solve complex problems. However with the
increase of complexity better methods are required. Keeping in view of the
above some researchers introduced the idea of hybrid mechanism in which two or
more methods can be combined which seems to be a positive effort for creating a
more complex; advanced and intelligent system which has the capability to in-
cooperate human decisions thus driving the landscape changes.",2014-09-03,2014,2014-09,environment,http://arxiv.org/abs/1409.1170v2
"Quantifying Natural and Artificial Intelligence in Robots and Natural
  Systems with an Algorithmic Behavioural Test","One of the most important aims of the fields of robotics, artificial
intelligence and artificial life is the design and construction of systems and
machines as versatile and as reliable as living organisms at performing high
level human-like tasks. But how are we to evaluate artificial systems if we are
not certain how to measure these capacities in living systems, let alone how to
define life or intelligence? Here I survey a concrete metric towards measuring
abstract properties of natural and artificial systems, such as the ability to
react to the environment and to control one's own behaviour.",2014-12-20,2014,2014-12,environment,http://arxiv.org/abs/1412.6703v2
"Quantifying Morphological Computation based on an Information
  Decomposition of the Sensorimotor Loop","The question how an agent is affected by its embodiment has attracted growing
attention in recent years. A new field of artificial intelligence has emerged,
which is based on the idea that intelligence cannot be understood without
taking into account embodiment. We believe that a formal approach to
quantifying the embodiment's effect on the agent's behaviour is beneficial to
the fields of artificial life and artificial intelligence. The contribution of
an agent's body and environment to its behaviour is also known as morphological
computation. Therefore, in this work, we propose a quantification of
morphological computation, which is based on an information decomposition of
the sensorimotor loop into shared, unique and synergistic information. In
numerical simulation based on a formal representation of the sensorimotor loop,
we show that the unique information of the body and environment is a good
measure for morphological computation. The results are compared to our
previously derived quantification of morphological computation.",2015-03-17,2015,2015-03,environment,http://arxiv.org/abs/1503.05113v1
Qsmodels: ASP Planning in Interactive Gaming Environment,"Qsmodels is a novel application of Answer Set Programming to interactive
gaming environment. We describe a software architecture by which the behavior
of a bot acting inside the Quake 3 Arena can be controlled by a planner. The
planner is written as an Answer Set Program and is interpreted by the Smodels
solver.",2015-05-27,2015,2015-05,environment,http://arxiv.org/abs/1505.07263v1
"An Empirical Comparison of Neural Architectures for Reinforcement
  Learning in Partially Observable Environments","This paper explores the performance of fitted neural Q iteration for
reinforcement learning in several partially observable environments, using
three recurrent neural network architectures: Long Short-Term Memory, Gated
Recurrent Unit and MUT1, a recurrent neural architecture evolved from a pool of
several thousands candidate architectures. A variant of fitted Q iteration,
based on Advantage values instead of Q values, is also explored. The results
show that GRU performs significantly better than LSTM and MUT1 for most of the
problems considered, requiring less training episodes and less CPU time before
learning a very good policy. Advantage learning also tends to produce better
results.",2015-12-17,2015,2015-12,environment,http://arxiv.org/abs/1512.05509v1
Category Theoretic Analysis of Photon-based Decision Making,"Decision making is a vital function in this age of machine learning and
artificial intelligence, yet its physical realization and theoretical
fundamentals are still not completely understood. In our former study, we
demonstrated that single-photons can be used to make decisions in uncertain,
dynamically changing environments. The two-armed bandit problem was
successfully solved using the dual probabilistic and particle attributes of
single photons. In this study, we present a category theoretic modeling and
analysis of single-photon-based decision making, including a quantitative
analysis that is in agreement with the experimental results. A category
theoretic model reveals the complex interdependencies of subject matter
entities in a simplified manner, even in dynamically changing environments. In
particular, the octahedral and braid structures in triangulated categories
provide a better understanding and quantitative metrics of the underlying
mechanisms of a single-photon decision maker. This study provides both insight
and a foundation for analyzing more complex and uncertain problems, to further
machine learning and artificial intelligence.",2016-02-26,2016,2016-02,environment,http://arxiv.org/abs/1602.08199v3
"Obstacle evasion using fuzzy logic in a sliding blades problem
  environment","This paper discusses obstacle avoidance using fuzzy logic and shortest path
algorithm. This paper also introduces the sliding blades problem and
illustrates how a drone can navigate itself through the swinging blade
obstacles while tracing a semi-optimal path and also maintaining constant
velocity",2016-05-03,2016,2016-05,environment,http://arxiv.org/abs/1605.00787v1
Minimally Naturalistic Artificial Intelligence,"The rapid advancement of machine learning techniques has re-energized
research into general artificial intelligence. While the idea of
domain-agnostic meta-learning is appealing, this emerging field must come to
terms with its relationship to human cognition and the statistics and structure
of the tasks humans perform. The position of this article is that only by
aligning our agents' abilities and environments with those of humans do we
stand a chance at developing general artificial intelligence (GAI). A broad
reading of the famous 'No Free Lunch' theorem is that there is no universally
optimal inductive bias or, equivalently, bias-free learning is impossible. This
follows from the fact that there are an infinite number of ways to extrapolate
data, any of which might be the one used by the data generating environment; an
inductive bias prefers some of these extrapolations to others, which lowers
performance in environments using these adversarial extrapolations. We may
posit that the optimal GAI is the one that maximally exploits the statistics of
its environment to create its inductive bias; accepting the fact that this
agent is guaranteed to be extremely sub-optimal for some alternative
environments. This trade-off appears benign when thinking about the environment
as being the physical universe, as performance on any fictive universe is
obviously irrelevant. But, we should expect a sharper inductive bias if we
further constrain our environment. Indeed, we implicitly do so by defining GAI
in terms of accomplishing that humans consider useful. One common version of
this is need the for 'common-sense reasoning', which implicitly appeals to the
statistics of physical universe as perceived by humans.",2017-01-14,2017,2017-01,environment,http://arxiv.org/abs/1701.03868v1
Don't Fear the Reaper: Refuting Bostrom's Superintelligence Argument,"In recent years prominent intellectuals have raised ethical concerns about
the consequences of artificial intelligence. One concern is that an autonomous
agent might modify itself to become ""superintelligent"" and, in supremely
effective pursuit of poorly specified goals, destroy all of humanity. This
paper considers and rejects the possibility of this outcome. We argue that this
scenario depends on an agent's ability to rapidly improve its ability to
predict its environment through self-modification. Using a Bayesian model of a
reasoning agent, we show that there are important limitations to how an agent
may improve its predictive ability through self-modification alone. We conclude
that concern about this artificial intelligence outcome is misplaced and better
directed at policy questions around data access and storage.",2017-02-27,2017,2017-02,environment,http://arxiv.org/abs/1702.08495v2
Ethical Artificial Intelligence - An Open Question,"Artificial Intelligence (AI) is an effective science which employs strong
enough approaches, methods, and techniques to solve unsolvable real world based
problems. Because of its unstoppable rise towards the future, there are also
some discussions about its ethics and safety. Shaping an AI friendly
environment for people and a people friendly environment for AI can be a
possible answer for finding a shared context of values for both humans and
robots. In this context, objective of this paper is to address the ethical
issues of AI and explore the moral dilemmas that arise from ethical algorithms,
from pre set or acquired values. In addition, the paper will also focus on the
subject of AI safety. As general, the paper will briefly analyze the concerns
and potential solutions to solving the ethical issues presented and increase
readers awareness on AI safety as another related research interest.",2017-05-16,2017,2017-05,environment,http://arxiv.org/abs/1706.03021v1
OPEB: Open Physical Environment Benchmark for Artificial Intelligence,"Artificial Intelligence methods to solve continuous- control tasks have made
significant progress in recent years. However, these algorithms have important
limitations and still need significant improvement to be used in industry and
real- world applications. This means that this area is still in an active
research phase. To involve a large number of research groups, standard
benchmarks are needed to evaluate and compare proposed algorithms. In this
paper, we propose a physical environment benchmark framework to facilitate
collaborative research in this area by enabling different research groups to
integrate their designed benchmarks in a unified cloud-based repository and
also share their actual implemented benchmarks via the cloud. We demonstrate
the proposed framework using an actual implementation of the classical
mountain-car example and present the results obtained using a Reinforcement
Learning algorithm.",2017-07-04,2017,2017-07,environment,http://arxiv.org/abs/1707.00790v1
"Investigating Reinforcement Learning Agents for Continuous State Space
  Environments","Given an environment with continuous state spaces and discrete actions, we
investigate using a Double Deep Q-learning Reinforcement Agent to find optimal
policies using the LunarLander-v2 OpenAI gym environment.",2017-08-08,2017,2017-08,environment,http://arxiv.org/abs/1708.02378v3
"Feasibility Study: Moving Non-Homogeneous Teams in Congested Video Game
  Environments","Multi-agent path finding (MAPF) is a well-studied problem in artificial
intelligence, where one needs to find collision-free paths for agents with
given start and goal locations. In video games, agents of different types often
form teams. In this paper, we demonstrate the usefulness of MAPF algorithms
from artificial intelligence for moving such non-homogeneous teams in congested
video game environments.",2017-10-04,2017,2017-10,environment,http://arxiv.org/abs/1710.01447v1
Towards a Deep Reinforcement Learning Approach for Tower Line Wars,"There have been numerous breakthroughs with reinforcement learning in the
recent years, perhaps most notably on Deep Reinforcement Learning successfully
playing and winning relatively advanced computer games. There is undoubtedly an
anticipation that Deep Reinforcement Learning will play a major role when the
first AI masters the complicated game plays needed to beat a professional
Real-Time Strategy game player. For this to be possible, there needs to be a
game environment that targets and fosters AI research, and specifically Deep
Reinforcement Learning. Some game environments already exist, however, these
are either overly simplistic such as Atari 2600 or complex such as Starcraft II
from Blizzard Entertainment. We propose a game environment in between Atari
2600 and Starcraft II, particularly targeting Deep Reinforcement Learning
algorithm research. The environment is a variant of Tower Line Wars from
Warcraft III, Blizzard Entertainment. Further, as a proof of concept that the
environment can harbor Deep Reinforcement algorithms, we propose and apply a
Deep Q-Reinforcement architecture. The architecture simplifies the state space
so that it is applicable to Q-learning, and in turn improves performance
compared to current state-of-the-art methods. Our experiments show that the
proposed architecture can learn to play the environment well, and score 33%
better than standard Deep Q-learning which in turn proves the usefulness of the
game environment.",2017-12-17,2017,2017-12,environment,http://arxiv.org/abs/1712.06180v1
"Narrow Artificial Intelligence with Machine Learning for Real-Time
  Estimation of a Mobile Agents Location Using Hidden Markov Models","We propose to use a supervised machine learning technique to track the
location of a mobile agent in real time. Hidden Markov Models are used to build
artificial intelligence that estimates the unknown position of a mobile target
moving in a defined environment. This narrow artificial intelligence performs
two distinct tasks. First, it provides real-time estimation of the mobile
agent's position using the forward algorithm. Second, it uses the Baum-Welch
algorithm as a statistical learning tool to gain knowledge of the mobile
target. Finally, an experimental environment is proposed, namely a video game
that we use to test our artificial intelligence. We present statistical and
graphical results to illustrate the efficiency of our method.",2018-02-09,2018,2018-02,environment,http://arxiv.org/abs/1802.03417v1
"Challenges and Characteristics of Intelligent Autonomy for Internet of
  Battle Things in Highly Adversarial Environments","Numerous, artificially intelligent, networked things will populate the
battlefield of the future, operating in close collaboration with human
warfighters, and fighting as teams in highly adversarial environments. This
paper explores the characteristics, capabilities and intelligence required of
such a network of intelligent things and humans - Internet of Battle Things
(IOBT). It will experience unique challenges that are not yet well addressed by
the current generation of AI and machine learning.",2018-03-20,2018,2018-03,environment,http://arxiv.org/abs/1803.11256v2
