title,summary,published,year,month,category,url
Artificial Intelligence and its Role in Near Future,"AI technology has a long history which is actively and constantly changing
and growing. It focuses on intelligent agents, which contain devices that
perceive the environment and based on which takes actions in order to maximize
goal success chances. In this paper, we will explain the modern AI basics and
various representative applications of AI. In the context of the modern
digitalized world, AI is the property of machines, computer programs, and
systems to perform the intellectual and creative functions of a person,
independently find ways to solve problems, be able to draw conclusions and make
decisions. Most artificial intelligence systems have the ability to learn,
which allows people to improve their performance over time. The recent research
on AI tools, including machine learning, deep learning and predictive analysis
intended toward increasing the planning, learning, reasoning, thinking and
action taking ability. Based on which, the proposed research intends towards
exploring on how the human intelligence differs from the artificial
intelligence. Moreover, we critically analyze what AI of today is capable of
doing, why it still cannot reach human intelligence and what are the open
challenges existing in front of AI to reach and outperform human level of
intelligence. Furthermore, it will explore the future predictions for
artificial intelligence and based on which potential solution will be
recommended to solve it within next decades.",2018-04-01,2018,2018-04,environment,http://arxiv.org/abs/1804.01396v1
Autonomous Wireless Systems with Artificial Intelligence,"This paper discusses technology and opportunities to embrace artificial
intelligence (AI) in the design of autonomous wireless systems. We aim to
provide readers with motivation and general AI methodology of autonomous agents
in the context of self-organization in real time by unifying knowledge
management with sensing, reasoning and active learning. We highlight
differences between training-based methods for matching problems and
training-free methods for environment-specific problems. Finally, we
conceptually introduce the functions of an autonomous agent with knowledge
management.",2018-06-27,2018,2018-06,environment,http://arxiv.org/abs/1806.10518v2
"Experience, Imitation and Reflection; Confucius' Conjecture and Machine
  Learning","Artificial intelligence recently had a great advancements caused by the
emergence of new processing power and machine learning methods. Having said
that, the learning capability of artificial intelligence is still at its
infancy comparing to the learning capability of human and many animals. Many of
the current artificial intelligence applications can only operate in a very
orchestrated, specific environments with an extensive training set that exactly
describes the conditions that will occur during execution time. Having that in
mind, and considering the several existing machine learning methods this
question rises that 'What are some of the best ways for a machine to learn?'
Regarding the learning methods of human, Confucius' point of view is that they
are by experience, imitation and reflection. This paper tries to explore and
discuss regarding these three ways of learning and their implementations in
machines by having a look at how they happen in minds.",2018-08-01,2018,2018-08,environment,http://arxiv.org/abs/1808.00222v1
"The Dreaming Variational Autoencoder for Reinforcement Learning
  Environments","Reinforcement learning has shown great potential in generalizing over raw
sensory data using only a single neural network for value optimization. There
are several challenges in the current state-of-the-art reinforcement learning
algorithms that prevent them from converging towards the global optima. It is
likely that the solution to these problems lies in short- and long-term
planning, exploration and memory management for reinforcement learning
algorithms. Games are often used to benchmark reinforcement learning algorithms
as they provide a flexible, reproducible, and easy to control environment.
Regardless, few games feature a state-space where results in exploration,
memory, and planning are easily perceived. This paper presents The Dreaming
Variational Autoencoder (DVAE), a neural network based generative modeling
architecture for exploration in environments with sparse feedback. We further
present Deep Maze, a novel and flexible maze engine that challenges DVAE in
partial and fully-observable state-spaces, long-horizon tasks, and
deterministic and stochastic problems. We show initial findings and encourage
further work in reinforcement learning driven by generative exploration.",2018-10-02,2018,2018-10,environment,http://arxiv.org/abs/1810.01112v1
Environments for Lifelong Reinforcement Learning,"To achieve general artificial intelligence, reinforcement learning (RL)
agents should learn not only to optimize returns for one specific task but also
to constantly build more complex skills and scaffold their knowledge about the
world, without forgetting what has already been learned. In this paper, we
discuss the desired characteristics of environments that can support the
training and evaluation of lifelong reinforcement learning agents, review
existing environments from this perspective, and propose recommendations for
devising suitable environments in the future.",2018-11-26,2018,2018-11,environment,http://arxiv.org/abs/1811.10732v2
"Evaluation of Multidisciplinary Effects of Artificial Intelligence with
  Optimization Perspective","Artificial Intelligence has an important place in the scientific community as
a result of its successful outputs in terms of different fields. In time, the
field of Artificial Intelligence has been divided into many sub-fields because
of increasing number of different solution approaches, methods, and techniques.
Machine Learning has the most remarkable role with its functions to learn from
samples from the environment. On the other hand, intelligent optimization done
by inspiring from nature and swarms had its own unique scientific literature,
with effective solutions provided for optimization problems from different
fields. Because intelligent optimization can be applied in different fields
effectively, this study aims to provide a general discussion on
multidisciplinary effects of Artificial Intelligence by considering its
optimization oriented solutions. The study briefly focuses on background of the
intelligent optimization briefly and then gives application examples of
intelligent optimization from a multidisciplinary perspective.",2019-02-04,2019,2019-02,environment,http://arxiv.org/abs/1902.01362v1
"Marathon Environments: Multi-Agent Continuous Control Benchmarks in a
  Modern Video Game Engine","Recent advances in deep reinforcement learning in the paradigm of locomotion
using continuous control have raised the interest of game makers for the
potential of digital actors using active ragdoll. Currently, the available
options to develop these ideas are either researchers' limited codebase or
proprietary closed systems. We present Marathon Environments, a suite of open
source, continuous control benchmarks implemented on the Unity game engine,
using the Unity ML- Agents Toolkit. We demonstrate through these benchmarks
that continuous control research is transferable to a commercial game engine.
Furthermore, we exhibit the robustness of these environments by reproducing
advanced continuous control research, such as learning to walk, run and
backflip from motion capture data; learning to navigate complex terrains; and
by implementing a video game input control system. We show further robustness
by training with alternative algorithms found in OpenAI.Baselines. Finally, we
share strategies for significantly reducing the training time.",2019-02-25,2019,2019-02,environment,http://arxiv.org/abs/1902.09097v1
"Artificial Intelligence in Intelligent Tutoring Robots: A Systematic
  Review and Design Guidelines","This study provides a systematic review of the recent advances in designing
the intelligent tutoring robot (ITR), and summarises the status quo of applying
artificial intelligence (AI) techniques. We first analyse the environment of
the ITR and propose a relationship model for describing interactions of ITR
with the students, the social milieu and the curriculum. Then, we transform the
relationship model into the perception-planning-action model for exploring what
AI techniques are suitable to be applied in the ITR. This article provides
insights on promoting human-robot teaching-learning process and AI-assisted
educational techniques, illustrating the design guidelines and future research
perspectives in intelligent tutoring robots.",2019-02-26,2019,2019-02,environment,http://arxiv.org/abs/1903.03414v1
Intelligent Autonomous Things on the Battlefield,"Numerous, artificially intelligent, networked things will populate the
battlefield of the future, operating in close collaboration with human
warfighters, and fighting as teams in highly adversarial environments. This
chapter explores the characteristics, capabilities and intelli-gence required
of such a network of intelligent things and humans - Internet of Battle Things
(IOBT). The IOBT will experience unique challenges that are not yet well
addressed by the current generation of AI and machine learning.",2019-02-26,2019,2019-02,environment,http://arxiv.org/abs/1902.10086v1
"An Actor-Critic-Attention Mechanism for Deep Reinforcement Learning in
  Multi-view Environments","In reinforcement learning algorithms, leveraging multiple views of the
environment can improve the learning of complicated policies. In multi-view
environments, due to the fact that the views may frequently suffer from partial
observability, their level of importance are often different. In this paper, we
propose a deep reinforcement learning method and an attention mechanism in a
multi-view environment. Each view can provide various representative
information about the environment. Through our attention mechanism, our method
generates a single feature representation of environment given its multiple
views. It learns a policy to dynamically attend to each view based on its
importance in the decision-making process. Through experiments, we show that
our method outperforms its state-of-the-art baselines on TORCS racing car
simulator and three other complex 3D environments with obstacles. We also
provide experimental results to evaluate the performance of our method on noisy
conditions and partial observation settings.",2019-07-19,2019,2019-07,environment,http://arxiv.org/abs/1907.09466v1
Artificial Intelligence Approaches,"Artificial Intelligence (AI) has received tremendous attention from academia,
industry, and the general public in recent years. The integration of geography
and AI, or GeoAI, provides novel approaches for addressing a variety of
problems in the natural environment and our human society. This entry briefly
reviews the recent development of AI with a focus on machine learning and deep
learning approaches. We discuss the integration of AI with geography and
particularly geographic information science, and present a number of GeoAI
applications and possible future directions.",2019-08-27,2019,2019-08,environment,http://arxiv.org/abs/1908.10345v1
"The Animal-AI Environment: Training and Testing Animal-Like Artificial
  Cognition","Recent advances in artificial intelligence have been strongly driven by the
use of game environments for training and evaluating agents. Games are often
accessible and versatile, with well-defined state-transitions and goals
allowing for intensive training and experimentation. However, agents trained in
a particular environment are usually tested on the same or slightly varied
distributions, and solutions do not necessarily imply any understanding. If we
want AI systems that can model and understand their environment, we need
environments that explicitly test for this. Inspired by the extensive
literature on animal cognition, we present an environment that keeps all the
positive elements of standard gaming environments, but is explicitly designed
for the testing of animal-like artificial cognition.",2019-09-12,2019,2019-09,environment,http://arxiv.org/abs/1909.07483v2
"A Perceived Environment Design using a Multi-Modal Variational
  Autoencoder for learning Active-Sensing","This contribution comprises the interplay between a multi-modal variational
autoencoder and an environment to a perceived environment, on which an agent
can act. Furthermore, we conclude our work with a comparison to
curiosity-driven learning.",2019-11-01,2019,2019-11,environment,http://arxiv.org/abs/1911.00584v1
"Artificial Intelligence Strategies for National Security and Safety
  Standards","Recent advances in artificial intelligence (AI) have lead to an explosion of
multimedia applications (e.g., computer vision (CV) and natural language
processing (NLP)) for different domains such as commercial, industrial, and
intelligence. In particular, the use of AI applications in a national security
environment is often problematic because the opaque nature of the systems leads
to an inability for a human to understand how the results came about. A
reliance on 'black boxes' to generate predictions and inform decisions is
potentially disastrous. This paper explores how the application of standards
during each stage of the development of an AI system deployed and used in a
national security environment would help enable trust. Specifically, we focus
on the standards outlined in Intelligence Community Directive 203 (Analytic
Standards) to subject machine outputs to the same rigorous standards as
analysis performed by humans.",2019-11-03,2019,2019-11,environment,http://arxiv.org/abs/1911.05727v1
"IKEA Furniture Assembly Environment for Long-Horizon Complex
  Manipulation Tasks","The IKEA Furniture Assembly Environment is one of the first benchmarks for
testing and accelerating the automation of complex manipulation tasks. The
environment is designed to advance reinforcement learning from simple toy tasks
to complex tasks requiring both long-term planning and sophisticated low-level
control. Our environment supports over 80 different furniture models, Sawyer
and Baxter robot simulation, and domain randomization. The IKEA Furniture
Assembly Environment is a testbed for methods aiming to solve complex
manipulation tasks. The environment is publicly available at
https://clvrai.com/furniture",2019-11-17,2019,2019-11,environment,http://arxiv.org/abs/1911.07246v1
Artificial Intelligence Aided Next-Generation Networks Relying on UAVs,"Artificial intelligence (AI) assisted unmanned aerial vehicle (UAV) aided
next-generation networking is proposed for dynamic environments. In the
AI-enabled UAV-aided wireless networks (UAWN), multiple UAVs are employed as
aerial base stations, which are capable of rapidly adapting to the dynamic
environment by collecting information about the users' position and
tele-traffic demands, learning from the environment and acting upon the
feedback received from the users. Moreover, AI enables the interaction amongst
a swarm of UAVs for cooperative optimization of the system. As a benefit of the
AI framework, several challenges of conventional UAWN may be circumvented,
leading to enhanced network performance, improved reliability and agile
adaptivity. As a further benefit, dynamic trajectory design and resource
allocation are demonstrated. Finally, potential research challenges and
opportunities are discussed.",2020-01-28,2020,2020-01,environment,http://arxiv.org/abs/2001.11958v1
Hacia los Comités de Ética en Inteligencia Artificial,"The goal of Artificial Intelligence based systems is to take decisions that
have an effect in their environment and impact society. This points out to the
necessity of mechanism that regulate the impact of this type of system in
society. For this reason, it is priority to create the rules and specialized
organizations that can oversight the following of such rules, particularly that
human rights precepts at local and international level. This work proposes the
creation, at the universities, of Ethical Committees or Commissions specialized
on Artificial Intelligence that would be in charge of define the principles and
will guarantee the following of good practices in the field Artificial
Intelligence.",2020-02-11,2020,2020-02,environment,http://arxiv.org/abs/2002.05673v1
"Wireless 2.0: Towards an Intelligent Radio Environment Empowered by
  Reconfigurable Meta-Surfaces and Artificial Intelligence","We introduce ""Wireless 2.0"": The future generation of wireless communication
networks, where the radio environment becomes controllable, programmable, and
intelligent by leveraging the emerging technologies of reconfigurable
metasurfaces and artificial intelligence (AI). This paper, in particular, puts
the emphasis on AI-based computational methods and commence with an overview of
the concept of intelligent radio environments based on reconfigurable
meta-surfaces. Later we elaborate on data management aspects, the requirements
of supervised learning by examples, and the paradigm of reinforcement learning
(RL) to learn by acting. Finally, we highlight numerous open challenges and
research directions.",2020-02-23,2020,2020-02,environment,http://arxiv.org/abs/2002.11040v1
Trust-based Multiagent Consensus or Weightings Aggregation,"We introduce a framework for reaching a consensus amongst several agents
communicating via a trust network on conflicting information about their
environment. We formalise our approach and provide an empirical and theoretical
analysis of its properties.",2020-04-06,2020,2020-04,environment,http://arxiv.org/abs/2004.02490v1
"Design of a dynamic and self adapting system, supported with artificial
  intelligence, machine learning and real time intelligence for predictive
  cyber risk analytics in extreme environments, cyber risk in the colonisation
  of Mars","Multiple governmental agencies and private organisations have made
commitments for the colonisation of Mars. Such colonisation requires complex
systems and infrastructure that could be very costly to repair or replace in
cases of cyber attacks. This paper surveys deep learning algorithms, IoT cyber
security and risk models, and established mathematical formulas to identify the
best approach for developing a dynamic and self adapting system for predictive
cyber risk analytics supported with Artificial Intelligence and Machine
Learning and real time intelligence in edge computing. The paper presents a new
mathematical approach for integrating concepts for cognition engine design,
edge computing and Artificial Intelligence and Machine Learning to automate
anomaly detection. This engine instigates a step change by applying Artificial
Intelligence and Machine Learning embedded at the edge of IoT networks, to
deliver safe and functional real time intelligence for predictive cyber risk
analytics. This will enhance capacities for risk analytics and assists in the
creation of a comprehensive and systematic understanding of the opportunities
and threats that arise when edge computing nodes are deployed, and when
Artificial Intelligence and Machine Learning technologies are migrated to the
periphery of the internet and into local IoT networks.",2020-05-19,2020,2020-05,environment,http://arxiv.org/abs/2005.12150v2
"Synergetic Learning Systems: Concept, Architecture, and Algorithms","Drawing on the idea that brain development is a Darwinian process of
``evolution + selection'' and the idea that the current state is a local
equilibrium state of many bodies with self-organization and evolution processes
driven by the temperature and gravity in our universe, in this work, we
describe an artificial intelligence system called the ``Synergetic Learning
Systems''. The system is composed of two or more subsystems (models, agents or
virtual bodies), and it is an open complex giant system. Inspired by natural
intelligence, the system achieves intelligent information processing and
decision-making in a given environment through cooperative/competitive
synergetic learning. The intelligence evolved by the natural law of ``it is not
the strongest of the species that survives, but the one most responsive to
change,'' while an artificial intelligence system should adopt the law of
``human selection'' in the evolution process. Therefore, we expect that the
proposed system architecture can also be adapted in human-machine synergy or
multi-agent synergetic systems. It is also expected that under our design
criteria, the proposed system will eventually achieve artificial general
intelligence through long term coevolution.",2020-05-31,2020,2020-05,environment,http://arxiv.org/abs/2006.06367v2
Human $\neq$ AGI,"Terms Artificial General Intelligence (AGI) and Human-Level Artificial
Intelligence (HLAI) have been used interchangeably to refer to the Holy Grail
of Artificial Intelligence (AI) research, creation of a machine capable of
achieving goals in a wide range of environments. However, widespread implicit
assumption of equivalence between capabilities of AGI and HLAI appears to be
unjustified, as humans are not general intelligences. In this paper, we will
prove this distinction.",2020-07-11,2020,2020-07,environment,http://arxiv.org/abs/2007.07710v1
"A deep Q-Learning based Path Planning and Navigation System for
  Firefighting Environments","Live fire creates a dynamic, rapidly changing environment that presents a
worthy challenge for deep learning and artificial intelligence methodologies to
assist firefighters with scene comprehension in maintaining their situational
awareness, tracking and relay of important features necessary for key decisions
as they tackle these catastrophic events. We propose a deep Q-learning based
agent who is immune to stress induced disorientation and anxiety and thus able
to make clear decisions for navigation based on the observed and stored facts
in live fire environments. As a proof of concept, we imitate structural fire in
a gaming engine called Unreal Engine which enables the interaction of the agent
with the environment. The agent is trained with a deep Q-learning algorithm
based on a set of rewards and penalties as per its actions on the environment.
We exploit experience replay to accelerate the learning process and augment the
learning of the agent with human-derived experiences. The agent trained under
this deep Q-learning approach outperforms agents trained through alternative
path planning systems and demonstrates this methodology as a promising
foundation on which to build a path planning navigation assistant capable of
safely guiding fire fighters through live fire environments.",2020-11-12,2020,2020-11,environment,http://arxiv.org/abs/2011.06450v1
DeepMind Lab2D,"We present DeepMind Lab2D, a scalable environment simulator for artificial
intelligence research that facilitates researcher-led experimentation with
environment design. DeepMind Lab2D was built with the specific needs of
multi-agent deep reinforcement learning researchers in mind, but it may also be
useful beyond that particular subfield.",2020-11-13,2020,2020-11,environment,http://arxiv.org/abs/2011.07027v2
"Empowering Things with Intelligence: A Survey of the Progress,
  Challenges, and Opportunities in Artificial Intelligence of Things","In the Internet of Things (IoT) era, billions of sensors and devices collect
and process data from the environment, transmit them to cloud centers, and
receive feedback via the internet for connectivity and perception. However,
transmitting massive amounts of heterogeneous data, perceiving complex
environments from these data, and then making smart decisions in a timely
manner are difficult. Artificial intelligence (AI), especially deep learning,
is now a proven success in various areas including computer vision, speech
recognition, and natural language processing. AI introduced into the IoT
heralds the era of artificial intelligence of things (AIoT). This paper
presents a comprehensive survey on AIoT to show how AI can empower the IoT to
make it faster, smarter, greener, and safer. Specifically, we briefly present
the AIoT architecture in the context of cloud computing, fog computing, and
edge computing. Then, we present progress in AI research for IoT from four
perspectives: perceiving, learning, reasoning, and behaving. Next, we summarize
some promising applications of AIoT that are likely to profoundly reshape our
world. Finally, we highlight the challenges facing AIoT and some potential
research opportunities.",2020-11-17,2020,2020-11,environment,http://arxiv.org/abs/2011.08612v1
On limitations of learning algorithms in competitive environments,"We discuss conceptual limitations of generic learning algorithms pursuing
adversarial goals in competitive environments, and prove that they are subject
to limitations that are analogous to the constraints on knowledge imposed by
the famous theorems of G\""odel and Turing. These limitations are shown to be
related to intransitivity, which is commonly present in competitive
environments.",2020-11-25,2020,2020-11,environment,http://arxiv.org/abs/2011.12728v2
