title,summary,published,year,month,category,url
"From Two-Dimensional to Three-Dimensional Environment with Q-Learning:
  Modeling Autonomous Navigation with Reinforcement Learning and no Libraries","Reinforcement learning (RL) algorithms have become indispensable tools in
artificial intelligence, empowering agents to acquire optimal decision-making
policies through interactions with their environment and feedback mechanisms.
This study explores the performance of RL agents in both two-dimensional (2D)
and three-dimensional (3D) environments, aiming to research the dynamics of
learning across different spatial dimensions. A key aspect of this
investigation is the absence of pre-made libraries for learning, with the
algorithm developed exclusively through computational mathematics. The
methodological framework centers on RL principles, employing a Q-learning agent
class and distinct environment classes tailored to each spatial dimension. The
research aims to address the question: How do reinforcement learning agents
adapt and perform in environments of varying spatial dimensions, particularly
in 2D and 3D settings? Through empirical analysis, the study evaluates agents'
learning trajectories and adaptation processes, revealing insights into the
efficacy of RL algorithms in navigating complex, multi-dimensional spaces.
Reflections on the findings prompt considerations for future research,
particularly in understanding the dynamics of learning in higher-dimensional
environments.",2024-03-27,2024,2024-03,environment,http://arxiv.org/abs/2403.18219v1
"The Transformation Risk-Benefit Model of Artificial Intelligence:
  Balancing Risks and Benefits Through Practical Solutions and Use Cases","This paper summarizes the most cogent advantages and risks associated with
Artificial Intelligence from an in-depth review of the literature. Then the
authors synthesize the salient risk-related models currently being used in AI,
technology and business-related scenarios. Next, in view of an updated context
of AI along with theories and models reviewed and expanded constructs, the
writers propose a new framework called ""The Transformation Risk-Benefit Model
of Artificial Intelligence"" to address the increasing fears and levels of AI
risk. Using the model characteristics, the article emphasizes practical and
innovative solutions where benefits outweigh risks and three use cases in
healthcare, climate change/environment and cyber security to illustrate unique
interplay of principles, dimensions and processes of this powerful AI
transformational model.",2024-04-11,2024,2024-04,environment,http://arxiv.org/abs/2406.11863v1
"Leveraging AI to Generate Audio for User-generated Content in Video
  Games","In video game design, audio (both environmental background music and object
sound effects) play a critical role. Sounds are typically pre-created assets
designed for specific locations or objects in a game. However, user-generated
content is becoming increasingly popular in modern games (e.g. building custom
environments or crafting unique objects). Since the possibilities are virtually
limitless, it is impossible for game creators to pre-create audio for
user-generated content. We explore the use of generative artificial
intelligence to create music and sound effects on-the-fly based on
user-generated content. We investigate two avenues for audio generation: 1)
text-to-audio: using a text description of user-generated content as input to
the audio generator, and 2) image-to-audio: using a rendering of the created
environment or object as input to an image-to-text generator, then piping the
resulting text description into the audio generator. In this paper we discuss
ethical implications of using generative artificial intelligence for
user-generated content and highlight two prototype games where audio is
generated for user-created environments and objects.",2024-04-25,2024,2024-04,environment,http://arxiv.org/abs/2404.17018v1
Elements Of Legislation For Artificial Intelligence Systems,"The significant part of the operational context for autonomous company
management systems is the regulatory and legal environment in which
corporations operate. In order to create a dedicated operational context for
autonomous artificial intelligence systems, the wording of local regulatory
documents can be simultaneously presented in two versions: for use by people
and for use by autonomous systems. In this case, the artificial intelligence
system will get a well-defined operational context that allows such a system to
perform functions within the required standards. Local regulations that provide
basis for the joint work of individuals and autonomous artificial intelligence
systems can form the grounds for the relevant legislation governing the
development and implementation of autonomous systems.",2024-05-05,2024,2024-05,environment,http://arxiv.org/abs/2407.10305v1
"Artificial Intelligence in Education: Ethical Considerations and
  Insights from Ancient Greek Philosophy","This paper explores the ethical implications of integrating Artificial
Intelligence (AI) in educational settings, from primary schools to
universities, while drawing insights from ancient Greek philosophy to address
emerging concerns. As AI technologies increasingly influence learning
environments, they offer novel opportunities for personalized learning,
efficient assessment, and data-driven decision-making. However, these
advancements also raise critical ethical questions regarding data privacy,
algorithmic bias, student autonomy, and the changing roles of educators. This
research examines specific use cases of AI in education, analyzing both their
potential benefits and drawbacks. By revisiting the philosophical principles of
ancient Greek thinkers such as Socrates, Aristotle, and Plato, we discuss how
their writings can guide the ethical implementation of AI in modern education.
The paper argues that while AI presents significant challenges, a balanced
approach informed by classical philosophical thought can lead to an ethically
sound transformation of education. It emphasizes the evolving role of teachers
as facilitators and the importance of fostering student initiative in AI-rich
environments.",2024-09-04,2024,2024-09,environment,http://arxiv.org/abs/2409.15296v1
Multi-agent Path Finding in Continuous Environment,"We address a variant of multi-agent path finding in continuous environment
(CE-MAPF), where agents move along sets of smooth curves. Collisions between
agents are resolved via avoidance in the space domain. A new Continuous
Environment Conflict-Based Search (CE-CBS) algorithm is proposed in this work.
CE-CBS combines conflict-based search (CBS) for the high-level search framework
with RRT* for low-level path planning. The CE-CBS algorithm is tested under
various settings on diverse CE-MAPF instances. Experimental results show that
CE-CBS is competitive w.r.t. to other algorithms that consider continuous
aspect in MAPF such as MAPF with continuous time.",2024-09-16,2024,2024-09,environment,http://arxiv.org/abs/2409.10680v1
"Fundamentals of legislation for autonomous artificial intelligence
  systems","The article proposes a method for forming a dedicated operational context in
course of development and implementation of autonomous corporate management
systems based on example of autonomous systems for a board of directors. The
significant part of the operational context for autonomous company management
systems is the regulatory and legal environment within which corporations
operate. In order to create a special operational context for autonomous
artificial intelligence systems, the wording of local regulatory documents can
be simultaneously presented in two versions: for use by people and for use by
autonomous systems. In this case, the artificial intelligence system will get a
well-defined operational context that allows such a system to perform functions
within the required standards. Local regulations that provide for the specifics
of the joint work of individuals and autonomous artificial intelligence systems
can create the basis of the relevant legislation governing the development and
implementation of autonomous systems.",2024-09-17,2024,2024-09,environment,http://arxiv.org/abs/2410.02769v1
"Towards an Autonomous Surface Vehicle Prototype for Artificial
  Intelligence Applications of Water Quality Monitoring","The use of Autonomous Surface Vehicles, equipped with water quality sensors
and artificial vision systems, allows for a smart and adaptive deployment in
water resources environmental monitoring. This paper presents a real
implementation of a vehicle prototype that to address the use of Artificial
Intelligence algorithms and enhanced sensing techniques for water quality
monitoring. The vehicle is fully equipped with high-quality sensors to measure
water quality parameters and water depth. Furthermore, by means of a
stereo-camera, it also can detect and locate macro-plastics in real
environments by means of deep visual models, such as YOLOv5. In this paper,
experimental results, carried out in Lago Mayor (Sevilla), has been presented
as proof of the capabilities of the proposed architecture. The overall system,
and the early results obtained, are expected to provide a solid example of a
real platform useful for the water resource monitoring task, and to serve as a
real case scenario for deploying Artificial Intelligence algorithms, such as
path planning, artificial vision, etc.",2024-10-08,2024,2024-10,environment,http://arxiv.org/abs/2410.05892v1
Generative AI for Accessible and Inclusive Extended Reality,"Artificial Intelligence-Generated Content (AIGC) has the potential to
transform how people build and interact with virtual environments. Within this
paper, we discuss potential benefits but also challenges that AIGC has for the
creation of inclusive and accessible virtual environments. Specifically, we
touch upon the decreased need for 3D modeling expertise, benefits of
symbolic-only as well as multimodal input, 3D content editing, and 3D model
accessibility as well as foundation model-specific challenges.",2024-10-31,2024,2024-10,environment,http://arxiv.org/abs/2410.23803v1
"Development of a Human-Robot Interaction Platform for Dual-Arm Robots
  Based on ROS and Multimodal Artificial Intelligence","In this paper, we propose the development of an interactive platform between
humans and a dual-arm robotic system based on the Robot Operating System (ROS)
and a multimodal artificial intelligence model. Our proposed platform consists
of two main components: a dual-arm robotic hardware system and software that
includes image processing tasks and natural language processing using a 3D
camera and embedded computing. First, we designed and developed a dual-arm
robotic system with a positional accuracy of less than 2 cm, capable of
operating independently, performing industrial and service tasks while
simultaneously simulating and modeling the robot in the ROS environment.
Second, artificial intelligence models for image processing are integrated to
execute object picking and classification tasks with an accuracy of over 90%.
Finally, we developed remote control software using voice commands through a
natural language processing model. Experimental results demonstrate the
accuracy of the multimodal artificial intelligence model and the flexibility of
the dual-arm robotic system in interactive human environments.",2024-11-08,2024,2024-11,environment,http://arxiv.org/abs/2411.05342v1
"Bio-inspired AI: Integrating Biological Complexity into Artificial
  Intelligence","The pursuit of creating artificial intelligence (AI) mirrors our longstanding
fascination with understanding our own intelligence. From the myths of Talos to
Aristotelian logic and Heron's inventions, we have sought to replicate the
marvels of the mind. While recent advances in AI hold promise, singular
approaches often fall short in capturing the essence of intelligence. This
paper explores how fundamental principles from biological
computation--particularly context-dependent, hierarchical information
processing, trial-and-error heuristics, and multi-scale organization--can guide
the design of truly intelligent systems. By examining the nuanced mechanisms of
biological intelligence, such as top-down causality and adaptive interaction
with the environment, we aim to illuminate potential limitations in artificial
constructs. Our goal is to provide a framework inspired by biological systems
for designing more adaptable and robust artificial intelligent systems.",2024-11-22,2024,2024-11,environment,http://arxiv.org/abs/2411.15243v1
"Publication Trends in Artificial Intelligence Conferences: The Rise of
  Super Prolific Authors","Papers published in top conferences contribute influential discoveries that
are reshaping the landscape of modern Artificial Intelligence (AI). We analyzed
87,137 papers from 11 AI conferences to examine publication trends over the
past decade. Our findings reveal a consistent increase in both the number of
papers and authors, reflecting the growing interest in AI research. We also
observed a rise in prolific researchers who publish dozens of papers at the
same conference each year. In light of this analysis, the AI research community
should consider revisiting authorship policies, addressing equity concerns, and
evaluating the workload of junior researchers to foster a more sustainable and
inclusive research environment.",2024-11-28,2024,2024-11,environment,http://arxiv.org/abs/2412.07793v1
"More complex environments may be required to discover benefits of
  lifetime learning in evolving robots","It is well known that intra-life learning, defined as an additional
controller optimization loop, is beneficial for evolving robot morphologies for
locomotion. In this work, we investigate this further by comparing it in two
different environments: an easy flat environment and a more challenging hills
environment. We show that learning is significantly more beneficial in a hilly
environment than in a flat environment and that it might be needed to evaluate
robots in a more challenging environment to see the benefits of learning.",2024-12-11,2024,2024-12,environment,http://arxiv.org/abs/2412.16184v1
